<?xml version="1.0" encoding="UTF-8"?><medicines xmlns:xsi="http://www.w3.org/2001/XMLSchema-instance" xsi:schemaLocation="./medicines.xsd"><medicine name="Flagyl"><group><![CDATA[antibiotic]]></group><analogs><![CDATA[Metronidazole]]></analogs><analogs><![CDATA[Abozole]]></analogs><analogs><![CDATA[Ambizole]]></analogs><versions version="TABLET"><pharm name="Pfizer"><certificate id="789"><startDate><![CDATA[1970-03-15]]></startDate><expirationDate><![CDATA[2025-03-15]]></expirationDate><registrationOrganization><![CDATA[FDA]]></registrationOrganization></certificate><package><type><![CDATA[BLISTER]]></type><amount><![CDATA[50]]></amount><price><![CDATA[45800]]></price></package><dosage><number><![CDATA[1]]></number><periodicity><![CDATA[2]]></periodicity></dosage></pharm><pharm name="PLIVA"><certificate id="15620"><startDate><![CDATA[1980-03-15]]></startDate><expirationDate><![CDATA[2030-03-15]]></expirationDate><registrationOrganization><![CDATA[FDA]]></registrationOrganization></certificate><package><type><![CDATA[BLISTER]]></type><amount><![CDATA[25]]></amount><price><![CDATA[25600]]></price></package><dosage><number><![CDATA[1]]></number><periodicity><![CDATA[3]]></periodicity></dosage></pharm></versions><versions version="CAPSULE"><pharm name="PLIVA"><certificate id="15619"><startDate><![CDATA[1980-03-15]]></startDate><expirationDate><![CDATA[2030-03-15]]></expirationDate><registrationOrganization><![CDATA[FDA]]></registrationOrganization></certificate><package><type><![CDATA[BLISTER]]></type><amount><![CDATA[50]]></amount><price><![CDATA[25600]]></price></package><dosage><number><![CDATA[2]]></number><periodicity><![CDATA[2]]></periodicity></dosage></pharm></versions></medicine><medicine name="Valium"><group><![CDATA[benzodiazepine]]></group><analogs><![CDATA[Diazepam]]></analogs><versions version="TABLET"><pharm name="Roche"><certificate id="123"><startDate><![CDATA[1960-01-25]]></startDate><expirationDate><![CDATA[2025-01-25]]></expirationDate><registrationOrganization><![CDATA[American Medical Association]]></registrationOrganization></certificate><package><type><![CDATA[BLISTER]]></type><amount><![CDATA[50]]></amount><price><![CDATA[25000]]></price></package><dosage><number><![CDATA[1]]></number><periodicity><![CDATA[4]]></periodicity></dosage></pharm></versions></medicine></medicines>